<?xml version="1.0" encoding="UTF-8"?><OTA_AirFlifoRS EchoToken="566732" TimeStamp="2003-03-17T09:30:47-05:00" Target="Production" Version="1.002" SequenceNmbr="1" xmlns="http://www.opentravel.org/OTA/2003/05" xmlns:xsi="http://www.w3.org/2001/XMLSchema-instance" xsi:schemaLocation="http://www.opentravel.org/OTA/2003/05OTA_AirFlifoRS.xsd">	<Success/>	<FlightInfoDetails TotalFlightTime="PT2H38M" TotalMiles="907">		<FlightLegInfo FlightNumber="1716" JourneyDuration="PT2H38M" LegDistance="907">			<DepartureAirport LocationCode="ATL"/>			<ArrivalAirport LocationCode="MSP" Diversion="0"/>			<MarketingAirline CompanyShortName="Delta" Code="DL">Delta Airlines</MarketingAirline>			<Equipment AirEquipType="738">Boeing 737-800</Equipment>			<DepartureDateTime Scheduled="2003-04-15T08:05:00"/>			<ArrivalDateTime Scheduled="2003-04-15T09:43:00" Estimated="2003-04-15T09:43:00"/>		</FlightLegInfo>	</FlightInfoDetails></OTA_AirFlifoRS>